 {"$schema":"./collection_schema_v2-8.json","hierarchyLevel":"series","abstract":"The soil moisture product is derived from the Advanced Scatterometer (ASCAT) backscatter observations and provided on a fixed Earth grid (12.5 km sampling) in time series format. The soil moisture product contains an estimate of the water content of the 0-5 cm topsoil layer, expressed in degree of saturation (0 to 100%). The algorithm used to derive saturation is based on a linear relationship of soil moisture and backscatter applying a change detection technique eliminating the contributions of vegetation, land cover and surface topography, considered invariant from year to year. Seasonal vegetation effects are modelled by exploiting the multi-angle viewing capabilities of ASCAT. The soil moisture algorithm has been developed by Technische Universität Wien (TU Wien), part of the EUMETSAT Satellite Application Facility on Support to Operational Hydrology and Water Management (H SAF) consortium. The soil moisture product represents a Climate Data Record (CDR) which is continuously extended every 2-4 months in a separate offline product called ASCAT Surface Soil Moisture Climate Data Record v7 Extension 12.5 km sampling - Metop (H120).","acronyms":["SSM ASCAT DR2021 TS12.5","H119","SSM ASCAT DR2021 EXT TS12.5","H120"],"creationDate":"2021-03-01","services":{"name":"Global","orbitType":"LEO"},"dataApplications":[{"label":"Climate","href":"/data/themes/climate"},{"label":"Climate system monitoring - Terrestrial","href":"/data/themes/climate/climate-system-monitoring-terrestrial"}],"dataPolicies":[{"href":"https://user.eumetsat.int/resources/user-guides/data-registration-and-licensing#ID-Data-Licensing","policy":"Free and unrestricted - CC-BY-4.0","policyId":"NoConditions"}],"datasetLanguage":"eng","datasetTitle":"ASCAT Surface Soil Moisture Climate Data Record v7 12.5 km sampling - Metop","dateStamp":"2024-08-09","dataTailorCustomisation":true,"digitalTransfers":[{"availability":"SAF archive","onLine":{"label":"Download product","href":"https://hsaf.meteoam.it/Products/Detail?prod=H119","function":"download","protocol":"https"},"formats":[{"name":"netCDF4","averageFileSize":"110 MB","fileFormatDescription":"netCDF4 following CF convention","filenameConvention":"<Product ID>_<CellNumber>.nc","frequency":"1","typicalFilename":["H119_0210.nc","H119_1220.nc"]},{"name":"netCDF4","averageFileSize":"7 MB","filenameConvention":"<Product ID>_<CellNumber>.nc","frequency":"2-6 (per annum)","typicalFilename":["H120_0210.nc","H120_1220.nc"]}]}],"distributors":[{"individualName":"EUMETSAT SAF on Support to Operational Hydrology and Water Management","organisationName":"H SAF","responsiblePartyRole":"distributor","email":"us_hsaf@meteoam.it","href":"http://h-saf.eumetsat.int"}],"eumetsatData":true,"id":"EO:EUM:DAT:0656","parameters":["Soil Moisture"],"language":"eng","location":{"coordinates":[[-180,85],[180,-85]],"type":"envelope"},"originator":{"individualName":"EUMETSAT SAF on Support to Operational Hydrology and Water Management","organisationName":"H SAF","responsiblePartyRole":"originator","email":"us_hsaf@meteoam.it","href":"http://h-saf.eumetsat.int"},"processingLevels":["Level 3"],"productStatus":"Released","processingMode":"CDR","satellites":[{"seriesName":"Metop","owner":"EUMETSAT","orbitType":"LEO","sensors":[{"name":"ASCAT","type":"Scatterometer"}]}],"temporalExtent":{"begin":"2007-01-01"},"thumbnails":[{"href":"https://user.eumetsat.int/s3/eup-strapi-media/h119_f8ba59eea4.png","name":"Thumbnail"}],"doi":{"id":"10.15770/EUM_SAF_H_0009","href":"https://doi.org/10.15770/EUM_SAF_H_0009","publisher":"EUMETSAT SAF on Support to Operational Hydrology and Water Management","publicationYear":"2021","author":"H SAF"},"modified":"2025-02-25T17:33:50.636Z","youngs_created_on":"2025-02-25T17:33:50.636Z","youngs_used_mapping":"JSON Record Mapping version 1.1","fulltext":"$schema ./collection_schema_v2-8.json hierarchyLevel series abstract The soil moisture product is derived from the Advanced Scatterometer (ASCAT) backscatter observations and provided on a fixed Earth grid (12.5 km sampling) in time series format. The soil moisture product contains an estimate of the water content of the 0-5 cm topsoil layer, expressed in degree of saturation (0 to 100%). The algorithm used to derive saturation is based on a linear relationship of soil moisture and backscatter applying a change detection technique eliminating the contributions of vegetation, land cover and surface topography, considered invariant from year to year. Seasonal vegetation effects are modelled by exploiting the multi-angle viewing capabilities of ASCAT. The soil moisture algorithm has been developed by Technische Universität Wien (TU Wien), part of the EUMETSAT Satellite Application Facility on Support to Operational Hydrology and Water Management (H SAF) consortium. The soil moisture product represents a Climate Data Record (CDR) which is continuously extended every 2-4 months in a separate offline product called ASCAT Surface Soil Moisture Climate Data Record v7 Extension 12.5 km sampling - Metop (H120). acronyms SSM ASCAT DR2021 TS12.5 H119 SSM ASCAT DR2021 EXT TS12.5 H120  creationDate 2021-03-01 services name Global orbitType LEO  dataApplications label Climate href /data/themes/climate  label Climate system monitoring - Terrestrial href /data/themes/climate/climate-system-monitoring-terrestrial   dataPolicies href https://user.eumetsat.int/resources/user-guides/data-registration-and-licensing#ID-Data-Licensing policy Free and unrestricted - CC-BY-4.0 policyId NoConditions   datasetLanguage eng datasetTitle ASCAT Surface Soil Moisture Climate Data Record v7 12.5 km sampling - Metop dateStamp 2024-08-09 dataTailorCustomisation true digitalTransfers availability SAF archive onLine label Download product href https://hsaf.meteoam.it/Products/Detail?prod=H119 function download protocol https  formats name netCDF4 averageFileSize 110 MB fileFormatDescription netCDF4 following CF convention filenameConvention <Product ID>_<CellNumber>.nc frequency 1 typicalFilename H119_0210.nc H119_1220.nc   name netCDF4 averageFileSize 7 MB filenameConvention <Product ID>_<CellNumber>.nc frequency 2-6 (per annum) typicalFilename H120_0210.nc H120_1220.nc      distributors individualName EUMETSAT SAF on Support to Operational Hydrology and Water Management organisationName H SAF responsiblePartyRole distributor email us_hsaf@meteoam.it href http://h-saf.eumetsat.int   eumetsatData true id EO:EUM:DAT:0656 parameters Soil Moisture  language eng location coordinates -180 85  180 -85   type envelope  originator individualName EUMETSAT SAF on Support to Operational Hydrology and Water Management organisationName H SAF responsiblePartyRole originator email us_hsaf@meteoam.it href http://h-saf.eumetsat.int  processingLevels Level 3  productStatus Released processingMode CDR satellites seriesName Metop owner EUMETSAT orbitType LEO sensors name ASCAT type Scatterometer     temporalExtent begin 2007-01-01  thumbnails href https://user.eumetsat.int/s3/eup-strapi-media/h119_f8ba59eea4.png name Thumbnail   doi id 10.15770/EUM_SAF_H_0009 href https://doi.org/10.15770/EUM_SAF_H_0009 publisher EUMETSAT SAF on Support to Operational Hydrology and Water Management publicationYear 2021 author H SAF  modified 2025-02-25T17:33:50.636Z youngs_created_on 2025-02-25T17:33:50.636Z youngs_used_mapping JSON Record Mapping version 1.1  ","schemaOrgDefinition":"{\"@context\":\"http://schema.org/\",\"@type\":\"Dataset\",\"url\":\"https://user.eumetsat.int/catalogue/EO:EUM:DAT:0656\",\"copyrightHolder\":{\"@type\":\"Organization\",\"name\":\"H SAF\",\"contactPoint\":{\"@type\":\"ContactPoint\",\"contactType\":\"customer support\",\"email\":\"us_hsaf@meteoam.it\",\"url\":\"http://h-saf.eumetsat.int\"}},\"copyrightYear\":\"2021\",\"creator\":{\"@type\":\"Organization\",\"name\":\"H SAF\",\"contactPoint\":{\"@type\":\"ContactPoint\",\"contactType\":\"customer support\",\"email\":\"us_hsaf@meteoam.it\",\"url\":\"http://h-saf.eumetsat.int\"}},\"dateCreated\":\"Fri Jan 01 00:03:00 UTC 2021\",\"dateModified\":\"Tue Jan 09 00:08:00 UTC 2024\",\"datePublished\":\"Fri Jan 01 00:03:00 UTC 2021\",\"isAccessibleForFree\":\"true\",\"keywords\":\"H119,H120,SSM ASCAT DR2021 TS12.5,SSM ASCAT DR2021 EXT TS12.5,Climate,Climate system monitoring - Terrestrial\",\"provider\":{\"@type\":\"Organization\",\"name\":\"H SAF\",\"contactPoint\":{\"@type\":\"ContactPoint\",\"contactType\":\"customer support\",\"email\":\"us_hsaf@meteoam.it\",\"url\":\"http://h-saf.eumetsat.int\"}},\"publisher\":{\"@type\":\"Organization\",\"name\":\"H SAF\",\"contactPoint\":{\"@type\":\"ContactPoint\",\"contactType\":\"customer support\",\"email\":\"us_hsaf@meteoam.it\",\"url\":\"http://h-saf.eumetsat.int\"}},\"schemaVersion\":\"3.5\",\"spatialCoverage\":{\"@type\":\"Place\",\"geo\":{\"@type\":\"GeoShape\",\"polygon\":\"-180  85  180  -85\"}},\"temporalCoverage\":\"Fri Jan 01 00:03:00 UTC 2021 / Tue Jan 09 00:08:00 UTC 2024\",\"thumbnailUrl\":\"https://user.eumetsat.int/s3/eup-strapi-media/h119_f8ba59eea4.png\",\"encodingFormat\":\"netCDF4\",\"description\":\"The soil moisture product is derived from the Advanced Scatterometer (ASCAT) backscatter observations and provided on a fixed Earth grid (12.5 km sampling) in time series format. The soil moisture product contains an estimate of the water content of the 0-5 cm topsoil layer, expressed in degree of saturation (0 to 100%). The algorithm used to derive saturation is based on a linear relationship of soil moisture and backscatter applying a change detection technique eliminating the contributions of vegetation, land cover and surface topography, considered invariant from year to year. Seasonal vegetation effects are modelled by exploiting the multi-angle viewing capabilities of ASCAT. The soil moisture algorithm has been developed by Technische Universität Wien (TU Wien), part of the EUMETSAT Satellite Application Facility on Support to Operational Hydrology and Water Management (H SAF) consortium. The soil moisture product represents a Climate Data Record (CDR) which is continuously extended every 2-4 months in a separate offline product called ASCAT Surface Soil Moisture Climate Data Record v7 Extension 12.5 km sampling - Metop (H120).\",\"identifier\":\"EO:EUM:DAT:0656\",\"name\":\"ASCAT Surface Soil Moisture Climate Data Record v7 12.5 km sampling - Metop\"}"}